<?xml version="1.0" encoding="UTF-8"?>
<!-- optimized sample XML -->
<RoleDiagram xmlns="model:organization-model" xmlns:xsi="http://www.w3.org/2001/XMLSchema-instance" xsi:schemaLocation="model:organization-model ../../main/resources/organization-model.xsd">
	<Agent id="15cf816f-fcde-4e5e-8758-e004f48e4ee3" name="Agent 1">
		<has value="1">
			<child>48ece1db-516b-4120-a608-5589001a79d0</child>
		</has>
		<possesses score="1">
			<child>b28db440-e1cf-4a75-9d37-dad779323bc5</child>
		</possesses>
	</Agent>
	<assignment agent="15cf816f-fcde-4e5e-8758-e004f48e4ee3" role="d3a3aa33-88c7-41a6-91a0-423e84354e7c" goal="5a95c6f2-ee0a-48c4-be2d-9e4ad29a25b8" />
	<Attribute id="48ece1db-516b-4120-a608-5589001a79d0" name="Attribute 1" type="POSITIVE_QUANTITY" />
	<Capability id="b28db440-e1cf-4a75-9d37-dad779323bc5" name="Capability 1" />
	<Characteristic id="66ff30ec-1419-417d-9eec-811dbe8941fa" name="Characteristic 1" />
	<Pmf id="176986f8-a2ad-46d9-8cc0-6cc539055769" name="Pmf 1">
		<moderates>
			<child>48ece1db-516b-4120-a608-5589001a79d0</child>
		</moderates>
	</Pmf>
	<Policy id="395c34bf-c713-4c38-9148-9e25d22c2d3c" name="Policy 1" />
	<InstanceGoal id="5a95c6f2-ee0a-48c4-be2d-9e4ad29a25b8" name="Instance Goal 1" specification="7c57110b-d910-437a-b674-0817ce92a963" />
	<Role id="d3a3aa33-88c7-41a6-91a0-423e84354e7c" name="Role 1">
		<achieves>
			<child>7c57110b-d910-437a-b674-0817ce92a963</child>
		</achieves>
		<contains value="1">
			<child>66ff30ec-1419-417d-9eec-811dbe8941fa</child>
		</contains>
		<needs>
			<child>48ece1db-516b-4120-a608-5589001a79d0</child>
		</needs>
		<requires>
			<child>b28db440-e1cf-4a75-9d37-dad779323bc5</child>
		</requires>
	</Role>
	<Goal id="7c57110b-d910-437a-b674-0817ce92a963" name="Goal 1" />
</RoleDiagram>
